"id","request.custom_id","success","result.product.title","result.product.book_description"
"1779DAD090BD43D0BBD67D9B5926E9FA",,true,"The Billionaire's Baby (Harlequin Mini # 19)","Garrett Winslow wants a woman to love him for himself, not for his family's money. So when he meets Haley Turner while on vacation in Mexico, he keeps his real name a secret. A family crisis abruptly ends their spring fling, and Garrett heads home, never knowing the night he spent with Haley has changed both of their lives forever..."
"C05937FD7AD4418CA66C8D183607F7AF",,true,"My Soul to Lose (Soul Screamers)","It was supposed to be a fun day, shopping at the mall with her best friend. Then the panic attack started and Kaylee Cavanaugh finds herself screaming, unable to stop. Her secret fears are exposed and it's the worst day of her life.. Until she wakes up in the psychiatric unit.She tries to convince everyone she's fine--despite the shadows she sees forming around another patient and the urge to scream which comes burbling up again and again. Everyone thinks she's crazy. Everyone except Lydia, that is. Another patient with some special abilities....An eBook novella exclusive prequel to Rachel Vincent's SOUL SCREAMERS series."
"26691E03ED1141338B1D5584145AD09B",,true,"Dreaming in Color","Genre: LGBT Paranormal . The sight of the red door saves Colin Baxter in his dream, but very quickly a man appears and the dream becomes a thing of raw sexual need with a person Colin can’t identify. He just knows the man needs him, and Colin aches to find and heal his lover…even if the man doesn’t really exist.. Marek Donovan just wants to be left alone to lick his wounds and recover from a terrible loss. The rundown house in Fiji suits his minimal needs just fine. He doesn’t want to face the world again, and on a small, secluded island figures he’s safe from everyone and everything. Particularly guilt from his past.. Dreams of this nameless man and his house plague Colin for two years, but he’s come to care about his phantom lover so deeply he doesn’t want them to end. Then Colin visits Fiji and comes face-to-face with the house from his visions, prompting him to believe these dreams just might be his destiny.. Colin knocks on the door, determined to find answers. What he finds is a man he already knows.. Publisher's Note: This book contains explicit sexual content, graphic language, and situations some readers may find objectionable: Anal play/intercourse, male/male sexual practices, violence."
"0CD29F7FFF004C009CF06B661877CFF7",,true,"Three for Me?","From New York Times and USA Today Bestselling author R.G. Alexander. Three men, a tomboy...and one erotic game that could change everything. Simon, Eric, Rafael, Lee...and Charli. It's never mattered that Charli is the only girl in the crowd. She's always been a tomboy, anyway. Just one of the guys.. Between work and Couch Potato Thursdays, life is pretty full. Sure, no man alive can get through the friend gauntlet, but thanks to her boys and her toys, she's got plenty of fantasy material. It's a win-win situation. Until Lee has a destination wedding in Cozumel--and Charli's ""best man"" duties take a kinky turn.. Through what looks to be foul play by Lee's new brides, Charli finds herself on a decidedly decadent shore excursion, playing ""The Race Erotic"". With each sexy challenge, it becomes clearer that down deep, she desires not one, not two, but all three of her remaining single buddies. . They're the only family she's ever known. She can't imagine living without them. Will she have to choose? Or will the final score be three to one?Warning: Naughty costumes, kinky toys, a boy, a girl...two more boys, all doing unspeakably dirty things to each other."
"EE9BBAFAE8F04042B2FBE56119CA6728",,true,"Only In My Dreams: Halle Pumas Series, Book 5","Delayed gratification has its place. This wouldn’t be it.Halle Pumas, Book 5Gabriel Anderson has accepted a unique position in the shifter world. He’s about to become a Hunter, one of the few trained and sanctioned to hunt down the rare rogue shifter dangerous to humans and shifters alike. There’s one catch: until his training is complete, he must hold off on marking his mate. No problem…after all, she probably couldn’t handle the sexual demands he dreams of making on her.Her mate’s apparent desertion devastates Sarah. And his friendship with another woman threatens the bond they should be sharing and building. Maybe flirting with another man will make him sit up and take notice—and finally win Gabe’s heart. It works. Almost too well.One touch of another man’s hand on Sarah’s tempting body brings every ounce of Gabe’s possessiveness roaring to the surface. He wastes no time making his erotic dreams of dominating her a reality—whether she’s ready for it or not.If she’s not, the only place he’ll ever have her is in his dreams…"
"7B8A41B8381C43D3A559169915B29642",,true,"Analog Science Fiction and Fact  Kindle Edition",
"10FFC758A6B749D88135B47BBAFAC9CF",,true,,
"69992DE1B148473EB13C920618A5B26E",,true,,
"D9C6BAF852D547DA844900EF6EB474A0",,true,"Prophecy: Child of Light: An Epic Vampire Paranormal Romance (Vampires Realm Romance Series Book 1)","New York Times and USA Today Best-selling paranormal romance author Felicity Heaton presents. Prophecy: Child of Light (Vampires Realm Romance Series Book 1)A vampire unlike any other, Prophecy lives life in the dark until the night she encounters a sensual dark-haired vampire who is both her enemy and the man who will change her world forever.. A loyal hunter for the Aurorea bloodline, Valentine is bound by duty to report her as the vampire of the prophecy, but he cannot shake the vision of them he saw in her blood.Torn between duty and desire, and determined to uncover the truth, Valentine goes against his order to execute her and kidnaps the beautiful Caelestis female instead.. Thrust into a terrifying world where the seven bloodlines and the Law Keepers are hunting her and her only hope for survival is Valentine, Prophecy battles her temptation to surrender to her illicit attraction to him and fights for her future.. When she discovers her extraordinary destiny, will she be strong enough to embrace it and stop a deadly war from igniting?. The first novel in the Vampires Realm series and the best selling Prophecy Trilogy, Prophecy: Child of Light, is part one in an epic tale of forbidden love that is sure to capture your heart and leave you craving more.. Prophecy: Child of Light is the first novel in the Vampires Realm romance series, and the first book in the Prophecy Trilogy. This vampire romance features a vampire hero who uncovers a dangerous secret, a vampire heroine who is more than meets the eye, a forbidden love, and a deadly war set to ignite, with a cast of vampires, demons, witches and more, plus lots of action and adventure--and steamy scenes! All Vampires Realm books have a guaranteed happily ever after, and some strong language. Enjoy!. Books in the Vampires Realm Romance SeriesBook 1: Prophecy: Child of LightBook 2: Prophecy: Caelestis and AuroreaBook 3: Dark Moon RisingBook 3.1: SpellboundBook 3.5: ReunionBook 4: Seventh CircleBook 5: Winter’s KissBook 6: Hunter’s MoonBook 7: MasqueradeBook 8: Hunger"
"C58CF588435243F0B551D5547731B569",,true,,
"95E1CE04F1F149E5BB5F81FE8A42D35F",,true,"The Ghost Shrink, the Accidental Gigolo, & the Poltergeist Accountant (Tickle My Fantasy / Karmic Consultants Book 1)","It’s not smart to piss off a poltergeist…A Tickle My Fantasy story.It’s bad enough to be sexually frustrated. But as a medium, it means until Lucy Cartwright gets some, she’s doomed. Oh no, not to death. Worse. To nightly visitations by recently deceased, wanna-be Cassanovas without the bodies to back it up. Then a living, breathing fantasy arrives on her doorstep, and Lucy thinks her dry spell is at an end.Much as he would like to be Lucy’s personal gigolo, PI Jake Cox has a job to do. He’s been sent to prevent her from getting laid until a particular horny phantom—and key witness in his mob investigation—pays her a visit. The real challenge? Keeping his own hands off Lucy long enough to get the job done.Or the lonely, geeky ghost of a murdered mob accountant could rip a hole in the fabric of the universe…"
"6551E889EC8F4396B038963760D56972",,true,"Dare to Believe (The Gray Court Book 1)","He’ll fulfill her wildest fantasies… but only if she believes.The Gray Court, Book 1Leo Dunne has been searching his entire life for the one person born just for him. He finds her working in his own company, but the shy little Ruby Halloway constantly hides from him. He hatches a devilish plot with her best friend to bring her out of her shell, and the result proves her desire is more than a match for his own.Ruby has had the hots for her boss for some time now, but she knows business and pleasure shouldn’t mix. While that can’t stop a girl from dreaming, she sticks by her guns and does her best never to be alone with the handsome CEO. Until the company masquerade party, where she discovers a passion with him that leaves a mark on her soul.A family emergency calls Leo away, and rather than spend one night out of Ruby’s arms, he convinces her to go with him. With his brother’s life on the line, it’s vital she learn how to deal with who, and what, her new lover really is…before it’s too late."
"CC2639F5535144FA9ED324393BB01A50",,true,"Recovery: Star Wars Legends (Short Story) (Star Wars: The New Jedi Order)","As the forces of darkness threaten to engulf the galaxy, one last defiant spark remains. . . . . Though the Yuuzhan Vong were victorious in their savage conquest of the planet Duro, they failed to extract sensitive information from Leia Organa Solo, who now barely clings to life after enduring the enemies' torture. Unless she receives medical attention soon, the badly wounded Princess and former head of the New Republic will surely die. Pursued by bounty hunters, Han Solo begins a race against time, only to find his urgent pleas for help rejected by planet after planet, as the Jedi are blamed for the continuing fight against the seemingly invincible aliens. Desperate, the Solos decide on a suicide mission. They must reach Coruscant, the New Republic's strife-ridden capital where traitors, appeasers, and assassins now share the same goal as the fierce Yuuzhan Vong: kill all Jedi... . BONUS: This short story also features an excerpt from Star Wars: New Jedi Order: Edge of Victory I: Conquest."
"EBE6E7495AA0426A951A32388D950524",,true,"The Knife's Edge (Historical Fantasy Romance--Short Story)","From the author of the Romantic Times Reviewer's Choice Nominee for Best First Series.... She's a queen with deadly enemies and dark sexual longings. She yearns to give herself over to the hands of another, even at the point of a blade. But can she trust her sacred medallion to protect her from the royal assasin who wants to seize her throne, her body, and her heart?. A yearning for submission.A dark need for control.A passion that consumes two lovers.. Everything they thought they believed can change on the edge of a knife's blade. Betrayal can become trust. Hatred can become love. Submission transforms into a humbling gift that cannot be denied.. (Warning: This short story is very steamy and contains behavior that ought be consensually negotiated with a partner in real life.). Story approximately 5k. Includes two excerpts from HQN Nocturne romance novels."
"26638C5807F7462E9F6EF0DF48B4398C",,true,"Surviving the Fog","Have you ever been to summer camp? What would you do if almost all of the adults left “for a few hours” and did not return? What would you do if cell phones did no work and your parents never showed up to take you home? What would you do if your camp was surrounded by a mysterious dangerous brown fog? How would you survive the winter? How would you get more to eat? How would you deal with outsiders?. Warning: sexual situations, cursing, brief violence"
"E1F1779F208B42AF87D86823551E0F96",,true,"Serial","Remember the twin golden rules of hitchhiking? # 1: Don't go hitchhiking, because the driver who picks you up could be certifiably crazy. # 2: Don't pick up hitchhikers, because the traveler you pick up could be raving nutcase. So what if, on some dark, isolated road, Crazy #1 offered a ride to Nutcase #2? . When two of the most twisted minds in the world of horror fiction face off, the result is SERIAL, a terrifying tale of hitchhiking gone terribly wrong. Like a deeply twisted version of an ""After School Special,"" SERIAL is the single most persuasive public service announcement on the hazards of free car rides. Beyond a thrilling piece of horrifying suspense, SERIAL is also a groundbreaking experiment in literary collaboration. Kilborn wrote the first part. Crouch wrote the second. And they wrote the third together over email in 100-word exchanges, not aware of each other's opening section. All bets were off, and may the best psycho win."
"EA836E56BB5C4A039F3386612F8D27CD",,true,"Misled (Carnal Thirst Book 1)","Special Task Force agent Derek Atkinson has a craving for luscious vampire Sable Taylor. But Sable is a bounty hunter, which makes him direct competition in the capture of wanted criminals. Despite the obvious attraction between them, she won't give him a chance and after two years, he's tired of waiting for her to come around. So he's got a plan to give them both what they want…each other. . Sable's on a dangerous mission. She's not who Derek thinks she is, so a relationship just isn't possible. But like most master vampires, Derek's wily and used to having his way. When he traps her on his ship, she decides to indulge. . Two straight days of mind-blowing sex should be enough, but it isn't, not for either of them. Her heart is involved now, but Sable can't let Derek get too close. If he finds out what she's doing, he'll never forgive her. Derek, however, refuses to let go. Now he's getting shot at and asking questions she shouldn't answer. Sable has to reveal the truth… Derek's love has been misled."
"E9BE1F4DEC154067BA8F6BE6A32C68AD",,true,"Dial 'M' for Mascara","Mary Grace Castilla is a diehard shopaholic from Dallas, Texas. She’s got big problems. Someone has been trying to kill her and she hasn’t got a clue as to why. A mostly all around good girl, she tithes to the church on time, she never shops in the eight items or less line with more than eight items, and she never mixes silk with cotton or misses a sale for more than 50% off. Regardless, the brake lines in her car were cut causing an eighteen wheeler massacre. Her rental car was blown to little, itty-bitty pieces and casualties included her oleanders and a neighbor’s pet poodle’s tail. Finally, someone tried to shoot her as she left her work. Fortuitously, she was saved when she dropped an expensive container of mascara and missed the bullet while reaching for the errant makeup. Suspects are dropping out of the woodwork like termites in New Orleans. Her boss, Jack Covington, seems a little too preoccupied with Mary Grace’s anatomy, particularly in her well-formed chumbawumbas. Her coworker, Trey Kennebrew, seems a little too interested in Mary Grace’s shopping habits and how she happens to feel at the moment. A local business owner, Lolita Lewis, just plain seems a little weird. Then there’s the strange blonde haired woman who carries an adorable baby around in a sling. The woman calls herself Deep Throat and pops up at odd times to warn Mary Grace of impending danger. As if life isn’t abnormal enough, a virile and hunky detective, Frederick Brogan, is on the case. Despite his obvious interest in Mary Grace and her hooters, he thinks she is a) a flake, b) a criminal, or c) all of the above and something else he can’t define. Mary Grace doesn’t think much of the comparison but since he’s a bona fide hottie and he’s feeling a little guilty because initially he didn’t believe her, she’s willing to give him the benefit of the doubt. In the meantime, she’s rip-roaring ready to do some investigative work on her own in order to find the bad guy or girl before they succeed in their ruthless mission and before they ruin any more of her high end shoes. Teaming up with her rabidly Catholic mother who wants her to instantly bear grandchildren, her smart mouthed friend who has a sixth sense for whether Mary Grace is getting any action or not, gregarious gay winery owners who don’t have a clue, and Deep Throat Mommy who knows something but isn’t saying anything important, Mary Grace is on a tear for the truth. God help the malls until she manages to unravel the mystery."
"DA8A339074F84568A7530901D8B6033B",,true,"Serial","Remember the twin golden rules of hitchhiking? # 1: Don't go hitchhiking, because the driver who picks you up could be certifiably crazy. # 2: Don't pick up hitchhikers, because the traveler you pick up could be raving nutcase. So what if, on some dark, isolated road, Crazy #1 offered a ride to Nutcase #2? . When two of the most twisted minds in the world of horror fiction face off, the result is SERIAL, a terrifying tale of hitchhiking gone terribly wrong. Like a deeply twisted version of an ""After School Special,"" SERIAL is the single most persuasive public service announcement on the hazards of free car rides. Beyond a thrilling piece of horrifying suspense, SERIAL is also a groundbreaking experiment in literary collaboration. Kilborn wrote the first part. Crouch wrote the second. And they wrote the third together over email in 100-word exchanges, not aware of each other's opening section. All bets were off, and may the best psycho win."
"E00BA69D376C42318D9732702C4E93E0",,true,"The Chronicles of Joe Muller, Detective: A Collection","NOTE: This edition has a linked ""Table of Contents"" and has been beautifully formatted (searchable and interlinked) to work on your Amazon e-book reader, Amazon Desktop Reader and your ipod e-book reader.. A collection of five thrilling Joe Muller books written by acclaimed mystery writer, Augusta Groner. . Detective Joe Muller observes human behaviour closely and absorbs atmosphere to draw his conclusions but is also capable of using disguise and subterfuge.. Joseph Muller, Secret Service detective of the Imperial Austrian police, is one of the great experts in his profession. In personality he differs greatly from other famous detectives. He has neither the impressive authority of Sherlock Holmes, nor the keen brilliancy of Monsieur Lecoq.. Muller is a small, slight, plain-looking man, of indefinite age, and of much humbleness of mien. A naturally retiring, modest disposition, and two external causes are the reasons for Muller’s humbleness of manner, which is his chief characteristic. One cause is the fact that in early youth a miscarriage of justice gave him several years in prison, an experience which cast a stigma on his name and which made it impossible for him, for many years after, to obtain honest employment.. But the world is richer, and safer, by Muller’s early misfortune.... Included in this volume:Book 1: The Case of the Lamp That Went OutBook 2: The Case of the Registered LetterBook 3: The Case of the Pocket Diary Found In the SnowBook 4: The Case of the Pool of Blood in the Pastor’s StudyBook 5: The Case of the Golden Bullet. Written in the tradition of the detective novels of Friedrich Glauser and a distant resemblance to Simenon’s Maigret, these are wonderful, well-written thrilling and vigorous stories. A must-have for classic mystery fans!"
"CB548841FDB840538F8E7E4A3F7FD724",,true,"Shifter Marked (Southern Shifters Book 1)","She's about to meet her mate. A wicked hot and surly shifter guardian who is strictly off limits. Which means things are about to turn very bad...Lucas Gunn has been kidnapped, examined and tortured. His only remaining tie to the outside world is in his dreams and the incredible woman who appears in them nightly. He thought she was nothing more than a figment of his imagination. Then she came for him.Kira MacDonald is in trouble… Her psychic ability to “see” things has gone haywire. She’s being plagued by false visions and dreams of a man she’s never met. She’s desperate for a cure, which means finding and bonding with a mate. Something she fears more than losing her mind. Too bad fate has other plans for her. Plans that include her rescuing one dark, controlling shifter.Passion and Pride. Duty and Danger. In the end, there's really only one choice... “I’m addicted to this series!”“This is a curl-your-toes and makes-you-sweat type of fantasy novel. It is amazingly sensual and just a little bit naughty…”"
"82609736950A47B8A1D97E32069A29A5",,true,"Off the Grid: Book One (The Jamie Keller Mystery Series 1)","When Jamie Keller's father is killed in Iraq by a roadside bomb, her mother decides to combat the financial and emotional stress by moving the family from Hamilton, Ohio to the rural town of Promise, Oregon.Fourteen-year-old Jamie narrates the tale of the journey, intermingling descriptions of family dynamics with her own personal philosophy of life.The victims of Jamie's scrutiny include: older sister Jenny, who listens to praise music and wears a WWJD bracelet; younger brother Jake, contained and brainy, with know-it-all tendencies; and little sister Jana, lover of animals and sometimes the comic relief.In Reno, Nevada, the mystery begins when Jamie's mother fails to pick the kids up at the mall as had been previously arranged.After waiting for hours in the blazing heat, brother Jake finally goes in search of his mom only to return with an amazing story. He has located the car, and everything in it is intact (including the family's pet cats), but Mrs. Keller is nowhere to be found. Intensive searching proves futile. Their mother has vanished!Nervous about becoming wards of the state of Nevada, and fearful of being put in separate foster homes, the Keller kids decide to avoid authority, choosing instead to take the gamble, and continue on to Promise, Oregon.On the way into town, a giant JESUS banner is the first sign that Promise is in a bible belt. Jenny is thrilled, Jamie, not so.Upon arriving at the ranch, the Kellers are met with further disappointment when they discover that the 'ranch' is nothing more than an old trailer, situated off the grid. Jake is in his element, with the challenge of solar panels, batteries and generators, but the girls are far from enchanted.War, religion, world peace, inner peace, dealing with financial stress and self sufficiency are some of the key topics in this often humerous story story.. Off the Grid is a contemporary novelette directed at a young teen audience but enjoyed by all ages."
"96E2635C70974ACEBEBAEFDC5BFAF3F0",,true,"Maiden Flight (Dragon Knights Book 1)","War is coming for the dragon knights…but love may find them first.. Dragon Knights, Book 1. A chance meeting with a young male dragon seals the fate of one adventurous female poacher. The dragon’s partner, a ruggedly handsome knight named Gareth, takes one look at the shapely woman and decides to do a little poaching of his own.. Sir Gareth both seduces and falls deeply in love with the girl who is not only unafraid of dragons but also possesses a rare gift—she can hear the beasts’ silent speech. He wants her for his mate, but mating with a knight is no simple thing. To accept a knight, a woman must also accept the dragon, the dragon’s mate…and her knight, Lars, too.. She is at first shocked, then intrigued by the lusty life in the Lair. But war is in the making and only the knights and dragons have a chance at ending it before it destroys their land and their lives. . This book has been revised for rerelease.Warning: Contains dragons, their sexy knights and a damsel who is not quite in distress. Sizzling hot m/f/m scenes may leave you breathing fire."
"BC0E27121DCC4EA7AFEC056B42FF04F8",,true,,
