"id","request.custom_id","success","result.product.title","result.product.book_description"
"A353D5E30E3C4ED1A9B2C19F85BBFCCA",,true,"The Rumblin: A Short Story (Suspense - Horror)","""This short story sucked me right in. Fast paced and compelling it is an excellent short read. I love the concept of the Rumblin' and the characters are wonderfully unique and well written."" - Jennifer Wylie, Author of Sweet Light . ""Bennington captures the beautiful, quirky, and sometimes frightening spirit of Appalachia."" - William Esmont, Author of FIRE. ABOUT THE RUMBLIN' (A SHORT STORY):Phil Knite is so ready for a vacation, but he and his family get more from mother nature than they can handle. The rumblin', as described by the Camp Ranger, is terrible force, something to be feared. Phil ignores the redneck ranger's advise and heads to bed. Later that night, when a wicked storm blows in from the north, Phil and his family are forced to shack up with the rest of the campers. Phil knew the Ranger was a little crazy, but he wasn't prepared for what lies within the rumblin'! . WARNING: THIS SHORT STORY IS LOOSELY BASED ON ACTUAL EVENTS.. Check out Jeff's other books: The Secret Tree (NEW), Creepy (The Full Collection), Twisted Vengeance, and Reunion! . In the summer of 2010, I took my family on a camping trip. We set up camp, started a fire, roasted hot dogs, and began what was supposed to be a great weekend. We knew there was a 30% chance of thunder showers but went anyway. Well, guess what? Within the first 3-4 hours of our weekend excursion, the sky turned black as night, the wind picked up and a huge wall of clouds came rushing at the campground like nothing I've ever seen before. The camp owner buzzed through the campground on a golf cart, urging all of us to come to the store basement before the storm hit. We did. . If you've ever been camping, you'll know that there are a varity of characters in a campground. With all of us packed like sardines, pets and all, the writer in me began to imagine what it would be like if we were trapped in there. What if we couldn't get out? What if a tree fell on the building and it caught on fire? What if one of the campers was a killer? Sounds crazy I know. But that's how my writerly mind works; I can't apologize for that. . While huddled up with my family, I started characterizing the other detainees and we had a few laughs. Before long, the rain dried up and we were set free. When we returned, I wrote The Rumblin'. I hope you enjoy it. It's short, but fast paced, filled with a great cast, and very suspenseful. . REVIEWS:""Reading the reviews of this book, I wondered if it was all it was hyped up to be. Reading it - I discovered it really was. The violence is beautifully executed, the plot is perfect in its speed and intensity and the characters are wonderfully written. Jeff Bennington has written a stunning story here. Ten out of ten."" - Michael Wilson. ""Jeff Bennington delivers scary, thrilling stories with a lot of heart. Make room at the top."" - Scott Nicholson, bestselling author of The Red Church. **Be sure to read REUNION, Jeff's #1 Amazon bestselling supernatural thriller, CREEPY, TWISTED VENGEANCE, and THE SECRET TREE (NEW)."
"03080E82BA8C495CBCC55B355CB83ECC",,true,,
"B9DECDA532DF460E8C8BEEE51A372E9E",,true,"The Blood That Bonds (The II AM Trilogy Book 1)","Two is trapped: hooked on heroin, held as property, forced to sell her body to feed the addiction. Time brings her ever closer to what seems an inevitable death and Two waits, uncaring, longing only for the next fix.. That’s when Theroen arrives, beckoning to his Ferrari and grinning his inscrutable grin. He is handsome. Confident. Eager to help lift her out of the life that’s grinding her down.. The only problem? Theroen is a vampire.. His blood can cure her addiction, grant her powers she has never had, change her forever into something greater than she was. But when he sinks his teeth into her neck, Theroen also thrusts Two into a world of danger, violence, madness and despair. The powerful, twisted elder Abraham will use her arrival to shatter the uneasy peace that exists in his mansion, bringing an end to the dark game he has been playing for centuries."
"5C04774FE850447DA1EF6679D2E9C4DE",,true,"The Complete Wizard of Oz Collection (All 15 books) (Illustrated)","All Wizard of Oz books for $.99: with active table of contents:Illustrated with 10 unique illustrations. The Wonderful Wizard of Oz ; The Marvelous Land of Oz ; The Woggle-Bug Book ; Ozma of Oz ; Dorothy and the Wizard in Oz ; The Road to Oz ; The Emerald City of Oz ; The Patchwork Girl of Oz ; Tik-Tok of Oz ; The Scarecrow of Oz ; Rinkitink in Oz ; The Lost Princess of Oz ; The Tin Woodman of Oz ; The Magic of Oz Glinda of Oz"
"5B5838A39BDF48E2B4C7125054828E53",,true,"The Billionaire's Baby (Harlequin Mini # 19)","Garrett Winslow wants a woman to love him for himself, not for his family's money. So when he meets Haley Turner while on vacation in Mexico, he keeps his real name a secret. A family crisis abruptly ends their spring fling, and Garrett heads home, never knowing the night he spent with Haley has changed both of their lives forever..."
"68EA574073E04A738DD3A75393625969",,true,"The Yemen Connection (An MP-5 CIA Series Thriller Book 4)","A Yemeni Terrorist’s Bold Plan That Will Be More Catastrophic Than Any America Has SeenA very wealthy Yemen businessman is in a bind: his adult son has been arrested in Saudi Arabia for drug trafficking, an offense that could lead to a life sentence.A Yemeni terrorist has a bold plan that will make 9/11 look like child’s play, killing thousands of Americans tourists in one fell swoop. But he has a problem. The plan costs money. A lot of money. And his financier has just been arrested. ˃˃˃ Can The MP-5 CIA Team Stop The Terrorist Before It’s Too Late?M.H. Sargent’s MP-5 CIA team wants to know what that plan is, and stop it. So, they have a simple solution: blackmail the businessman. If he poses as a jihadist sympathizer willing to fund the terrorist, thereby giving the CIA team details of the terror plot, his son receives a get-out-of-jail free card. Of course, you know what happens with the best laid plans...Scroll Up And Grab Your Copy Today!"
"C4FE01A0ABBE4C539FB34B9EE31CFCD0",,true,"Fresh Powder","'The short, snappy dialogue moves along at speed, keeping the storyline twisting and turning nicely. This 'Sex Lite' skiing romp is no Jackie Collins, more of an Agatha Christie-meets-Mills&Boon on a James Bond set.' - Irish Independent.. The story; Lucy and Claire were once best friends but after a row, they haven't spoken in ten years. Imagine their shock when they are thrown together, not only in the same ski resort in the French Alps but in the same chalet. Then they are snowed in, together with two attractive men and a couple with relationship issues, which puts both their friendship and their survival skills to the test.. A new, corrected version was uploaded on February 7, 2012.. NOTE TO AMERICAN READERS: This book has British spelling and grammar as is written and spoken in Europe, Ireland included, which might look like spelling errors. Example: Cosy (British) spelling, cozy (American spelling), realise (British spelling), realize (American spelling) and so on. The heroines are Irish and it would seem strange if they spoke American English."
"A39B56D6CA5F4231AD9E49C83F379867",,true,,
"9BF59A986AB14116827DCB75234485FE",,true,"Seducing Jane Porter","Being bad never felt so good…After being jilted by her former master, Jane Porter looks to end her year-long celibacy by attending a bondage-themed event. Thanks to her ex-boyfriend’s stunning betrayal, she isn’t looking for happily-ever-after, just a master who’s willing to explore the depths of her passion and teach her what the BDSM lifestyle is all about. Antonio Villareal was a wanted man. Single, rich and good looking, he’s on the hunt for a submissive to share his world. The moment he sees Jane on the arm of another man, he wants to possess her body and soul. The only problem is; Jane makes it clear she isn’t a forever kind of girl. Can Antonio convince Jane to give him a chance?"
"199DB1EB8FD043C58F16BDB005709AEF",,true,"Flirting in Traffic","Blush: This is a sensual romance (may have explicit love scenes, but not erotic level) She went off like a red-hot firecracker on his foyer floor, then vanished. Esa never intended to participate in her best friend’s unorthodox dating scheme—flirting with hunky construction workers in Chicago traffic. Her thoughts changed when she saw a long, lean slice of heaven strutting around the side of the highway. For him, she would be the carefree sex kitten her borrowed car with its suggestive license plates implied she was. Though smarting from the wounds of a recent breakup, Finn can’t resist the tempting redhead driving the come-and-get-me car, flashing him contemptuous looks with those brandy-colored eyes. The lure of taming the feisty little kitten is just too great to deny… Reader Advisory: This book contains smoking hot, sexy scenes."
"1FF4E04885334FE587339AF63F0FD0A2",,true,"Perfect Crime","A San Francisco wife plots to murder her philandering husband by being in two places at one time. She commits the Perfect Crime and starts an exciting new life with a sexy new boyfriend, living off the life insurance policy of her murdered husband. Until her doorbell rings one night . . . ."
"33F6C99282EF4397BEE7C676573CDF72",,true,"I Witch: The Powers of the Blood and the Heart","Meagan Wallace is hallucinating a drop-dead gorgeous guy in her shower, and at inconvenient moments at work. This might possibly be entertaining for her, except that she can’t control it, the images and sensations she is getting are far more vivid than she is accustomed to her brain constructing for her, and the scary part is that if he’s not just some random daydream, but is in fact a real person sending her visions; then who is he? And why is he doing this? And how does he know her name?. When she finally discovers who he is; she still has to figure out what he is, whether or not she’ll find herself on the menu next to the stir-fry, and then decide if she can handle the consequences of being a witch serving a powerful goddess, who’s agenda may not coincide with Meagan’s…"
"9693A37CA9C841CFA6E1A6E7C49DEF83",,true,"MRS. BEAST (PRINCESS BEAST Book 1)","An enchantingly dark story about what became of the great fairy tale beauties after they said “I DO”. . The story begins with Beauty, who shortly after marrying the Prince realized she preferred her loving Beast to the vain and eccentric Prince. Leaving the comforts of the castle behind, she embarks on a quest to find Elora, the enchantress who changed the beast into a Prince, and convince her to change him back into the Beast. . Her quest takes her through Grimm Land, a place where angst clings and spreads like lichen, and where she meets Snow White, Rapunzel, Sleeping Beauty and Cinderella and learns what became of them after they married their princes. Snow White lives in a commune deep in the woods with the Seven Dwarfs, their seven wives and many children. Rapunzel lives in the low end of Storyendburg and makes her living on the streets. Sleeping Beauty is an opium addict living in the Kingdom of Dreams, and Cinderella hides behind a veil refusing to accept the toll aging has taken. . Mrs. Beast turns fairy tale beauty inside out and invites the reader to do the same in this delicious twist on these fairy tale classics."
"AA37AB3320A640F19B9C7F59AEC31B30",,true,"The Awakening: The Novella That Introduced the Leopard People (Leopard series Book 1)","#1 New York Times bestselling author Christine Feehan takes readers deep into the exotic Borneo rainforest as she introduces the Leopard people in this steamy paranormal romance novella.. Under the blazing heat of the Borneo sun, a beautiful naturalist’s dream comes true—to live among the feral jungle creatures. But an untamed, irresistible beast of another sort forces Maggie to explore her own wild side..."
"2E22A6A47C244F51BF10272902616EEF",,true,,
"C72968858B554C558CC3893148794908",,true,"Gone With The Monster: Monsters in Hollywood, Book 3","Kidnapping and bondage are no way to win a girl. Well, actually... . Monsters in Hollywood, Book 3 . Runako has good reason to distrust humans. His sister's murder taught him it's safer to keep his Monster form under wraps. Now comes word that a woman is making a movie that will supposedly ""help"" his people. He's not sure about that, but one thing is sure…Margo is too beautiful to be ignored. Presented with the opportunity to use his people's Captive Caves—a secluded mountain fortress designed to hold hapless, tasty humans prisoner—Runako knows exactly whom he wants to star in his ultimate fantasy.Margo knows exactly what she wants and how to get it. At least where her career is concerned. Runako is just the kind of bad boy with whom she'd like to heat up her nights. In a land of skinny blondes, though, a hottie like him would never notice her lush, Latin curves.No one is more surprised when she finds out his version of ""wooing"" includes kidnapping. Forced to stand before him in chains, her paper-thin confidence is burning up fast in the heat of his desire. And when it turns out she can identify his sister's murderers, they both must decide where their loyalties lie...Warning: This title contains light bondage, spanking, anal play, sex with a Monster and misuse of home decor."
"B60744869BE04C7F87D24064FFDE10B2",,true,,
"0335C6E52C0E4190AE66FA71049109CA",,true,,
"1305BFB92E334C99B500C089B4A834EF",,true,"The New York Times - Daily Edition for Kindle  Kindle Edition",
"B361E72098C7485E8BE5878B6419C056",,true,"Complete Mark Twain Collection (300+ works) (Illustrated)","The entire Mark Twain anthology with over 300 books and story collections. See the sample for the complete and navigable table of contents. Illustrated with 10 unique illustrations.. CONTENTS . THE INNOCENTS ABROADMARK TWAIN'S (BURLESQUE) AUTO-BIOGRAPHY FIRST ROMANCE.ROUGHING ITTHE GILDED AGE (with Charles Dudley Warner)SKETCHES NEW AND OLDTHE CURIOUS REPUBLIC OF GONDOUR AND OTHER WHIMSICAL SKETCHES1601--CONVERSATION AT THE SOCIAL FIRESIDE OF THE TUDORSTHE FACTS CONCERNING THE RECENT CARNIVAL OF CRIME IN CONNECTICUTTHE ADVENTURES OF TOM SAWYERTHE LOVES OF ALONZO FITZ CLARENCE AND ROSANNAH ETHELTON AND OTHER STORIESSOME RAMBLING NOTES OF AN IDLE EXCURSIONTHE STOLEN WHITE ELEPHANTA TRAMP ABROADTHE PRINCE AND THE PAUPERLIFE ON THE MISSISSIPPITHE ADVENTURES OF HUCKLEBERRY FINNA CONNECTICUT YANKEE IN KING ARTHUR'S COURTTHE AMERICAN CLAIMANTEXTRACTS FROM ADAM'S DIARYIN DEFENSE OF HARRIET SHELLEYFENNIMORE COOPER'S LITERARY OFFENCESESSAYS ON PAUL BOURGETTOM SAWYER ABROADTHE TRAGEDY OF PUDD'NHEAD WILSONTHOSE EXTRAORDINARY TWINSPERSONAL RECOLLECTIONS OF JOAN OF ARCTOM SAWYER, DETECTIVEFOLLOWING THE EQUATOR, A JOURNEY AROUND THE WORLDTHE MAN THAT CORRUPTED HADLEYBURG AND OTHER STORIESWHAT IS MAN AND OTHER ESSAYS IS SHAKESPEARE DEAD?THE MYSTERIOUS STRANGER AND OTHER STORIESA DOUBLE BARRELED DETECTIVETHE $30,000 BEQUEST AND OTHER STORIES THE $30,000 BEQUEST A DOG'S TALE A BURLESQUE BIOGRAPHY HOW TO TELL A STORY EXTRACTS FROM ADAM'S DIARY EVE'S DIARYA HORSE'S TALECHRISTIAN SCIENCEEXTRACT FROM CAPTAIN STORMFIELD'S VISIT TO HEAVENGOLDSMITH'S FRIEND ABROAD AGAIN HOW TO TELL A STORY THE WOUNDED SOLDIER THE GOLDEN ARM MENTAL TELEGRAPHY AGAIN THE INVALIDS STORYMARK TWAIN'S SPEECHESMARK TWAIN'S LETTERS 1853-1910. and more...."
"D2163BDB70BE43CC9E99F4F632E4F03A",,true,"Maggie's Mates","Having recently ended a bad relationship, Maggie Ryan returns to her hometown in Michigan’s Upper Peninsula to discover things aren’t quite the way she remembers. Her childhood friends, Quinn and Lucas Makwa, are all grown up and keeping secrets. The shape-shifters want Maggie for their mate, but she’s not sure she wants to trust another man—let alone two that can shift into black bears at will."
"6009990736EA4865A7E32B5E5DC81944",,true,,
"534EC9AD0BB14041B5C997C3147BB314",,true,"His Voice, His Command","A door closes behind Rina, trapping her in a sensual world. A powerful and imposing man orders her to surrender everything to him. Heart hammering and body crying out for sex, she begins to obey the male she calls Sir. With the loss of each piece of clothing, she sinks deeper into sensation. A part of her wants to flee, to return to order and reason, but how can she think, let alone act, when his hands freely roam her captured body? As for Sir, he won’t accept anything less than total obedience from his sex slave."
"5A87F9843B4C4CE2885A01D50E7007C3",,true,"Hidden Desires [Tri-Omega Mates 3] (Siren Publishing Menage Amour Manlove)","[Siren Menage Amour: Gay Menage a Trois Romance, M/M/M]  After watching his alpha and beta almost lose their mate, Thomas decides he needs some time alone. Driving across country, he discovers Micah, a human that smells like dark chocolate and summer rain. He knows immediately that Micah is his mate but before he can claim him, he has to get Micah's sexy little butt out of trouble. They are attacked by a band of bullies. In his bid to protect his mate, Thomas reveals his true nature to the bullies and to Micah. Afterwards, he has to call in reinforcements to help clean up the mess. It comes in the form of Caleb Hunter, alpha of the Hunter Pack and Micah's other mate.  But Micah's human. Isn't he? Siren Erotic Romance"
"533D769BD67F4CAC98FB6683C18322B2",,true,"The Zombie Chronicles: Outbreak","It was the start of another ordinary day at the office for Max, he was emailing a friend when one of his other early morning co-workers called for his help, someone was having a heart attack. Rushing to the aid of his fallen co-worker Max knew one thing, it wasn't a heart attack. Heart attack victims didn't bleed and didn't start chewing on anyone they could catch either. Once the victims died they came back to life with only one goal; to consume the living. Now Max was stuck in a rapidly deteriorating situation thirty miles from home, where his wife and two kids were sleeping away the warm mid summer morning. He had to get back to his family and get them to a safe place, if he could find one. Forming a group made up of his coworkers Steve and Tom and a police officer called 'Stewart' they make their way into the city to save the ones they love. The newly returned, however, were not all mindless shamblers and some of them had a plan.... This is a revised edition (2.2) uploaded on March 26th, 2011 and incorporates many spelling and grammar fixes send in from fans. Thanks for the feedback!"
"7616EF71418D4C8986BA8B6EAD8A96C6",,true,"Veterans: Through the Fire","Genre: Multicultural Erotic ContemporarySeries: Veterans; Previous Book: Risen from Ash by Rachel Bo. Baldwin Garrett should consider himself a lucky man. After surviving a tour in Iraq he's finally home. But instead, he's riddled with guilt and despair. As a young man he spurned his parents' wealth, looking down on their power and influence. Now as an injured Vet he has accepted their help to get the best possible medical care available--an option that wasn't available to his comrades in arms.. His guilt has overpowered him to the point he's pushing everyone away.. Kena Rutherford was hired by Baldwin's mother to open his house. She unwisely decides to skinny-dip in the pool, only to be discovered by Baldwin when he arrives home unexpectedly early. Although he's a bit surly, she's intrigued by this man who seemingly has everything, but is despondent about his life. She doesn't let their boss/employee relationship get in the way of her speaking her mind.. Baldwin finds Kena's sassy disposition and sharp words arouse his desire like no other woman he's ever met. Can she pull him through the fire of his despair and make him see how blessed he truly is?. Publisher's Note: This book contains explicit sexual content, graphic language, and situations that some readers may find objectionable: Anal sex, mild bondage."
"F80A0BC3145C4FAABBCB796CA5D23525",,true,"My Soul to Lose (Soul Screamers)","It was supposed to be a fun day, shopping at the mall with her best friend. Then the panic attack started and Kaylee Cavanaugh finds herself screaming, unable to stop. Her secret fears are exposed and it's the worst day of her life.. Until she wakes up in the psychiatric unit.She tries to convince everyone she's fine--despite the shadows she sees forming around another patient and the urge to scream which comes burbling up again and again. Everyone thinks she's crazy. Everyone except Lydia, that is. Another patient with some special abilities....An eBook novella exclusive prequel to Rachel Vincent's SOUL SCREAMERS series."
"8EF9C5F508244D46A430946FFE163E1B",,true,"Keller in Dallas: a Keller short story","This novella continues the story of Keller, after the wistful stamp-collecting hit man retired in New Orleans at the end of Hit & Run. A phone call and an economic downturn is all it takes to put him back in business.Keller in Dallas, a Kindle bestseller, serves too as the opening episode of Lawrence Block's brand-new bestseller, Hit Me."
"CF5BFA5E4AD64CE893EB728975F7FA74",,true,"Hallowing Eve","Bad weather, a secluded mountain cabin, and a box full of intriguing sex toys provide the backdrop for Lisa to seduce her colleague, Eve. (2,730 words)"
"7A6264133E6C4F6C91503E31A8ACDDF2",,true,"In the Mood","Jude Patterson is a sexy but shy romance novelist who discovers the flowery language he's always used in historical love scenes doesn't translate well to contemporary romances. Alyssa Stone is a beautiful fan who offers to help him learn to write better love scenes. . Jude is fascinated by Alyssa, whose confident and sensual demeanor conceals a very vulnerable interior. Before long, he's the one showing her how to write love scenes... and maybe even how to write happy endings.. Length: Novella, 24,000 words."
"441B4F270B7E4CEBA823C7927197F608",,true,"Head Over Heels: A Cinderella Story","Sometimes you have to make your own happily ever after.Working at the Glass Slipper is anything but a fairytale for Cyn Elder. After one especially long day, all she wants is to kick off her shoes and put her feet up, but she reluctantly lets her friends drag her out to a new club. Movie mogul and fledgling club owner Parker Maguire is bored with the Hollywood scene and its plastic women, and the club scene isn’t proving to be much better. Until he finds a sassy woman refusing to back down from his overzealous bouncer. Cyn is a breath of fresh air, neither impressed by celebrity status nor bowled over by his charisma and wealth. She’s honest, genuine—and arousing in more ways than he could have ever imagined. For once, Cyn puts herself before her shop and lets herself be swept off her feet by a man who pursues her with a delightful vengeance. Her father’s evil girlfriend and her two lazy daughters, however, see Cyn’s new happiness as nothing more than a threat to their own comfortable lives. Their plot to break the two lovers up could turn Parker and Cyn’s “once upon a time” into a “happily never after.” Unless Cyn’s Fairy Drag Queen can pull something out of her pink-chiffon sleeve…"
"46C42860DE674BAF9517612600AC834F",,true,"Babylonian Laws- The Oldest Code of Laws in the World","The Code of Hammurabi is the earliest and best preserved law codes from ancient Babylon, created ca. 1760 BC. It was enacted by the sixth Babylonian king, Hammurabi."
"5B90926848E9415BA7F071E735C7BBC4",,true,"Howling for My Baby (Cannon Pack Book 1)","Romeo and Juliet never had to worry about being skinned alive.Sydney Skeller’s father is spitting bullets over her reluctance to join the family business as a shifter hunter. The last thing Daddy needs to know is why—she yearns for a lover who’s man enough for a relationship but animal enough to give her the wild ride of her dreams. After a treadmill mishap lands her in a tangled heap with Jason Cannon, she wonders if she’s finally found her beast, er, man. One session in bed and one bite later, she’s sure. Now if only she can keep her father from mounting Jason’s head on a wall…Jason is all man on the surface, but wolf shifter down to the bone. He’s more than ready to stop “playing the pack” and find his one true mate, and Sydney of the luscious curves is the woman of his dreams. Finding out that she comes from a family sworn to eradicate his kind isn’t a deal-breaker. But her outrageous plan for him to masquerade as the wolf in hunter’s clothing, right under her father’s very nose, could be asking more than he ever expected to give.This book was previously published in ebook form only under the title Kissin’ in the Moonlight, and has been revised from its original release."
"9D28BD2F7EA5490FAF54CD3C5A7A978C",,true,"Oliver Twist","This book was converted from its physical edition to the digital format by a community of volunteers. You may find it for free on the web. Purchase of the Kindle edition includes wireless delivery."
"1E4151A9117B447895BF8C8168E5A289",,true,"Colters' Wife (Colters' Legacy)","Colters' Wife is the free short story follow up to Colters' Woman. It's an extended epilogue and gives readers a glimpse into the lives of the Colters after Holly returns home in Colters' Woman.  The correct reading order of the series is Colters' Woman, Colters' Wife, Colters' Lady, Colters' Daughter, Colters' Promise and Colters' Gift."
