"id","request.custom_id","success","result.product.title","result.product.book_description"
"E3E04E95629746AAA11D18E9D8872F28",,true,"Elements Unbound (Werewolves of Malta, Book One)","Book 1 in the Werewolves of Malta series.Bruno Tangaree has a mission. With his guidance and strength, the Werewolves of Malta will know more glory than any pack on Earth. And he's chosen his mate—the only woman who not only makes him burn with hunger, but who can match his special gift—to run by his side as he leads his kind. It's time to run his little lady to ground.Renee has fled from her sire, angry, hating the knowledge that he'd agree to a mating for the money and prestige it would bring his den. He has sold her like a piece of chattel, and she won't stand for it.When Bruno, the rogue werewolf no den would approve of, approaches her, she's terrified and excited at the same time. Strong, determined, dark and sexy, he's been the source of more fantasies than she can count. But now he knows her darkest secret, and seduces her so quickly she forgets the meaning of the word no.Bruno shows her that by mastering the elements, developing and sharing their gifts will make them the strongest werewolves ever to walk this planet."
"DF15591EB93E41ED8A601E27F812DDE7",,true,"Delver Magic Book I: Sanctum's Breach","A rolling tremor passes through the land of Uton signaling the return of long absent magic as well as an ancient evil. Ryson Acumen, purebred delver, learns the Sphere of Ingar, a talisman that captured all magical energy long ago, is free from its tomb in Sanctum Mountain. As violent, evil creatures return to shred every notion of reality, the sphere gains awareness and chooses to spew corrupted magical power to obliterate all life.. The sphere must be destroyed but it rests within Sanctum, a hollow mountain with a single path to its center. The way remains defended by devices crafted long ago, forged by members of each race to thwart entry into the inner core. Those that wish to defeat the sphere must not only overcome these barriers, they must conquer the mistrust which has flourished during the long period of separation. Human, elf, dwarf, algor and delver must reunite to face the secrets of the ages that once undone will change their lives forever."
"703089DF6E674B3D803DBA11ECBD57CD",,true,"His Convenient Husband (Innamorati Book 1)","A temporary arrangement? Don’t bet the ranch on it…Innamorati, Book 1At the tender age of seven, newly orphaned Micah Jiminez lost everything—and got lucky. The Delaney family opened their hearts and their home, treated him like one of their own. One Delaney in particular, though, became more than a brother to Micah. The handsome and protective Tucker is the man to whom he wants to give his love.But after a single passionate night together, Tucker rebuffs him and hightails it to Dallas to pursue his dreams. Leaving Micah to pick up the pieces of his broken heart—and feeling like a fool.The impending death of the Delaney patriarch brings an unsavory relative out of the woodwork, threatening Micah’s beloved adopted family. They’re going to need all hands in the fight to keep The Bar D from being pulled out from under them all—including Tucker. Micah steels himself to convince the man he can’t forget to come home.To his everlasting surprise, it’s Tucker who comes up with the perfect solution: a marriage of convenience—to Micah. His gut tells him Tucker’s motivation involves nothing more than saving the ranch. Now he just has to convince his fragile heart.This title has been revised and expanded by more than 10,000 words from its original published version."
"C02BC3F4069B41AC848AE7B85D1A97DE",,true,,
"C7A0A72B03ED4148957BF8EE3C973D1F",,true,"Pink Buttercream Frosting","Desire: Blend sinful with sweet. Whip to perfection. Don’t forget to lick the spoon…Aidn Greer is a much-sought-after Dominant in the BDSM lifestyle with an unusual problem. He hasn’t owned a submissive in more years than he cares to think about. He’s bored with unchallenging women, yet mentoring other Doms and training subs has left him cold as well. He’s craving something other than plain old vanilla—a taste of something sinfully sweet that, for once, he can really sink his teeth into.Professional cake baker Bailey Harris wasted ten years bored to tears with her marriage, enduring a job she hated, and harboring a secret desire for something passionate, fulfilling and dark. Then she found it…in the world of BDSM. Exploring on her own brought the kind of mind-opening experiences that led her to declare her independence—and exposed a yearning to find the one Dom for whom she’s willing to kneel. Permanently.When Aidn and Bailey meet, it’s fire and ice. Sugar and spice. And an experience that satisfies every detail of both their fantasies. Almost. While the big, beautiful sub is everything Aidn wanted, her fierce independent streak could be more of a challenge than he bargained for…"
"34F0AB38394B4871BA1265E0B1DC2467",,true,,
"130164EFA6F743F9BFE88460262ED59F",,true,"Perfect Crimes","Two convicts, about to be released from prison, plan to commit a perfect crime which will enrich themselves. No one else will know a crime has been committed. All goes well until they decide Jim Blakely must be eliminated.. Jim is camping near Lake Powell in Southern Utah, doing a little amateur archeology exploring when two dirty biker show up with a contract on Jim's head. After harrowing escapes and danger, Jim turns the tables and eliminates the bikers.. Meanwhile, Jim's wife, Susan has returned to her old home near Boston to find out why her mother is acting strangly. She determines that her new step-father is drugging her mother. She gives him a taste of his own medicine.. Jim returns to his Provo, Utah home and is abducted by the man who hired the bikers. He is taken to Utah's West Desert, where his captor plans to make Jim talk, and then leave his body where it will never be found."
"0AEAD07CCFAA410BA1AE44BD48794600",,true,"Gomadic Essential Kit for The Amazon Kindle All Models Including The Fire/HD/HDX/DX/Touch/Keyboard (WiFi and 3G) Includes a Car and Wall Charger",
"F254194CA7BE4C988B51DC994C9CC677",,true,"The Complete Wizard of Oz Collection (All 15 books) (Illustrated)","All Wizard of Oz books for $.99: with active table of contents:Illustrated with 10 unique illustrations. The Wonderful Wizard of Oz ; The Marvelous Land of Oz ; The Woggle-Bug Book ; Ozma of Oz ; Dorothy and the Wizard in Oz ; The Road to Oz ; The Emerald City of Oz ; The Patchwork Girl of Oz ; Tik-Tok of Oz ; The Scarecrow of Oz ; Rinkitink in Oz ; The Lost Princess of Oz ; The Tin Woodman of Oz ; The Magic of Oz Glinda of Oz"
"45D3BE85C41640479ACA7EDB12090ED6",,true,"BEYOND MALICE","When Nora Royce - a sexy associate in a prestigious Los Angeles law firm,- is accused of brutally murdering a partner's wife the legal community throws her to the wolves. Only her sister, Amanda Cross, a third-rate attorney, is willing to defend her. Amanda, armed with a tenacious spirit, no leads, and no criminal defense experience, is determined to prove herself but knives are out. As this outgunned lawyer peels away the protective layers that cocoon the privileged few she reveals intentions that seem to be beyond reproach but are, in fact, beyond malice and she might just be next on their list of expendables.“Twisted with murder, intrigue, greed and romance with another shocking ending!”"
"B0E15477BE794E8AB25604DC25F6E152",,true,,
"30A3667F1B114579AB5946DA5E2DD861",,true,"The Highland Rogues: Warrior Bride","Lachlan MacGown has been long suspicious of the mysterious warrior ""Hunter"" and when he discovers that ""he"" is a she, Lachlan couldn't be more stunned...or delighted! But no matter how lovely the lass is, he's seen her conferring with an enemy of his clan, and he doesn't trust her an inch. Especially when she takes a job as nursemaid to that enemy's young children. So Lachlan appoints himself her escort, refusing to leave her side—which makes for very interesting days...and nights!"
"52B0713DC3B14DC592CE916C16DFF159",,true,"The Birth of the Peacekeepers.","Edited by Frankie Sutton and revised by Ricky Sides on March 7th, 2011.Centered around a series of natural disasters of biblical proportions that are occurring on a global scale, tens of millions have died as a result of the earthquakes, floods, hurricanes, gigantic super cell thunderstorms and tornados that are ravaging the earth. A rogue nation decides to take advantage of the chaos at this time to attack America with nuclear weapons. The American intelligence network learns of the plan and the government decides to launch a first strike at this rogue nation. This information leaks out to other nations and soon the world is poised on the brink of all out nuclear conflagration as the nuclear nations choose sides in the coming conflict. As the militaries of the world go underground in preparation for the attack most of the world is blissfully ignorant of what is about to happen. There are a few exceptions to this. The civilians that are aware make plans to try to survive the attack as well. As the moment for the attack draws near, the disaster plagued planet is beset by earthquakes of unprecedented intensity and numbers. Oddly the epicenters seem to be located at every major military installation around the world. (It is implied and hinted at that divine intervention has saved mankind from nuclear war, though it is never outright stated.) When the survivors of the earthquakes look around them the next morning they see a world drastically changed. A few men and women struggle to cope with the devastation as best they can but many turn to marauding as a means of survival. Preying on any people they encounter they slaughter any that oppose them as they take anything they want. A few of the survivors band together to protect those weaker than themselves. Jim Wilison: Martial arts expert trained in survival techniques. Superb marksman. Gifted martial artist. Tactical training for leadership. Sniper skills. Patricia Huxley: 28 year old woman who was a Child prodigy specializing in computer programming. Tim Wilison: 13 year army corps of engineers. Demolition specialist, pilot of small single engine aircraft as a hobby. Marksman, student of military battle tactics. Lina: A free spirited woman dead set on exploring the country to see what is left. Rescued by Jim and trained extensively. Lacey Carteen: A woman trying to raise her eight year old son in the post cataclysmic setting. Rescued by Jim. Learned survival training from Jim. Becomes a stabilizing influence in his life. Evan Carteen: 8 year old son of Lacey who helps heal an old wound in Jim's soul and in the process make him a better man. Pete Damroyal: Aging veteran of Vietnam war era. Sniper. guerilla warfare specialist. Organized large survival group in Chicago Illinois. Superb tactician. Hand to hand combat specialist. Leader of the survival group. Maggie Peterson: An attractive woman in her mid thirties with short black hair worn in a short shag. Maggie had been a trauma care specialist at Northwestern Memorial Hospital in Chicago who was known for her volatile temper and her at times unorthodox approach to saving lives. She had been brought up on charges upon three separate occasions for deviating from protocol. In each case her unorthodox approach saved the lives of her patients whereas following the protocols would have failed to do so therefore the Chief of Staff ordered the incorporation of her new techniques into standard treatment protocols."
"53846E504B4A49909DD0E3A805A5AC87",,true,"L.A. Caveman","Keep it strictly business? Her heart demands something more... The last thing columnist Stanna needs is a fight with her hopelessly chauvinistic brand-new boss, Jake. The attractive man turns the office into an undeniably sizzling environment, but his column suggestions are positively Neanderthal! She's determined to reform Jake. He's determined to train Stanna. Neither is willing to acknowledge the electrifying attraction that pulls at them both.. ""Crooks definitely has a sultry slow-burning writing style that builds anticipation at each turn of the page."" - Zee, Fire Pages. ""Crooks' L.A. CAVEMAN is a wonderfully written contemporary romance novel with a great storyline that was fast paced and kept my heart racing."" - Romance Junkies. ""L.A. Caveman is a well-written, funny, sexy, sweet story that you will enjoy"" - Yvette Lowe, Siren Book Reviews. ""Reminiscent of a Hepburn and Tracey movie with office romance and a conflict involving two very strong-minded and very philosophically opposed main characters."" - Phoebe Imel, Addicted2Romance. ""I laughed, I gasped and I tingled. Ms. Crooks has penned a riveting, funny tale about a woman in a man's world."" - Seriously Reviewed"
"1B690BF2FB604E0A8199FD9D2ACCCFB1",,true,"The Guardians: Book One of the Restoration Series","Flare is a young half elf who has been raised by the elves. Despite having spent his entire life with the elves, he has never really been accepted and lives the life of an outcast. . As his thirtieth birthday approaches, Flare makes a momentous decision. He decides to travel to the Southern city of Telur to join the Guardians. The Guardians are the elite part of the Telurian army, and anyone can join; even foreigners. . The elves are outraged, and Flare is forced to flee the elven forest and travel alone to the human city of Telur, where he joins the Guardians and begins his military training. . Flare is assigned to the western Fort of Mul-Dune, where he continues traveling the path of prophecy. Unknowingly, Flare has began down the path of an ancient and cryptic prophecy. A prophecy that the church of Adel will do anything to keep from being fulfilled. Anything, including murder."
"ABF5CF031A5849989999CE4A1CDE975D",,true,"Awakened Desires","Karyn Simmons and Malcolm Knight are destined for each other, or so their shared dreams of lovemaking tell them. But while Malcolm has no problem accepting fate, Karyn does. She's had far too much heartbreak in the past to just blindly trust a dream. . And she may be right not to... . Even though Malcolm sees her as his one true love, he is hiding a few things from her that threaten their chance at happiness. He is a vampire, and the brother of a deranged killer. Will Karyn reject him, or will her desire turn into love as well? . This is not your typical vampire romance. K Lynne Duvall's story turns these mythological beings from dark, savage monsters into creatures more human and real. The drama amongst all the characters keeps you engaged and wondering what will happen next. The passion will have you begging for more. . Parental discretion is advised: This book contains graphic description of sexual activity and violence."
"3E43AE7E32804995B90FD63D83FDD87C",,true,"Remedial Magic: A Faeriewalker Bonus Story","Delve deeper into the world of the fae with this Faeriewalker bonus story from Jenna Black.. In ""Remedial Magic,"" Kimber finds that having a prodigy for an older brother is not so fun…especially one who is magic wiz-kid. But Kimber has a plan to finally step out of his shadow."
"E705CB921DC446F19BC31585A06075CE",,true,,
"EA5F4EF7192A4F35B046A0D8409EC157",,true,"The Guardians: Book One of the Restoration Series","Flare is a young half elf who has been raised by the elves. Despite having spent his entire life with the elves, he has never really been accepted and lives the life of an outcast. . As his thirtieth birthday approaches, Flare makes a momentous decision. He decides to travel to the Southern city of Telur to join the Guardians. The Guardians are the elite part of the Telurian army, and anyone can join; even foreigners. . The elves are outraged, and Flare is forced to flee the elven forest and travel alone to the human city of Telur, where he joins the Guardians and begins his military training. . Flare is assigned to the western Fort of Mul-Dune, where he continues traveling the path of prophecy. Unknowingly, Flare has began down the path of an ancient and cryptic prophecy. A prophecy that the church of Adel will do anything to keep from being fulfilled. Anything, including murder."
"B401D2C7416340659F5040050E0F3743",,true,"The Strength of Three","Never let it be said that ex-soldiers don’t know what to do with their hands…. When it comes to men, Christina isn’t just gun shy, she’s downright terrified. Her abusive drunk of a father, plus bad experiences in high school and college, have cemented her belief that all men are the same—ruthless and violent at the slightest provocation.. She tells herself she couldn’t care less about her lack of a love life. Yet lately she’s been having seriously erotic dreams about two of her bosses. And oddly, those dreams make her body tingle, not seize up in a panic attack.. TJ and Jon have shared women since their military days. Somehow it makes them feel whole. From the first glance, Christina has been the object of their desire, but getting close to the prickly female hasn’t been easy—not when she holds men off with a psychological pitchfork. They’ve waited a long time to ease their way into her life.. Time’s up.. Unleashing her libido is magic made in the dark. But by the light of day, a face from her past threatens to destroy everything.Warning: This title contains the following: Blindfolds and bondage and sex—oh my. Ooh, and let’s not forget about the m/f/m ménage and the graphic language."
"F07D91DF41CC45D28452CF9CCBD3145A",,true,"Refuge (Skyport Virgo Book 1)","As a political refugee on twenty-fourth century Earth, Laleh Sarafpour suddenly faces deportation to her hellish home planet because of a ridiculous clerical error. She never expects a chance meeting with Pike Grayson, a deliciously sexy Spacefleet admiral, to drastically change her life. In the span of a night, Pike saves Laleh from her sadistic half-brother sent to haul her back to the nightmare of her past life and offers her a chance to save herself: a marriage of convenience for naturalization papers.. From the moment Pike claps eyes on Laleh, he craves the breathtakingly exotic beauty. Pike's desire ignites the second she accepts his proposal, but her innocence in the pleasures of the flesh forces him to practice a little patience. With the gentlest of seductions, Pike introduces Laleh to all the naughty delights to be found in a marriage bed.. As they journey across galaxies to Pike’s first command station, the sizzling attraction between the pair proves to be explosive. But when Laleh’s past threatens to catch up with them, Pike risks everything to protect the woman who has managed to so perfectly capture his heart."
"28C7EBDBC26F41DF9ACF348BAD0B1560",,true,,
"F9C9BACBC21F4050BEE7AA94B15F73F6",,true,"Dream Machine (Play Doctor Book 1)","The best dreams are made of naughty and spice.Rebecca Williams is about to achieve her goal of graduating from a prestigious university and winning a coveted spot in her mentor’s cutting-edge psychology practice. She just needs one more qualification: sexual experience. She never dreamed it would come at the hands of the man she’s admired and wanted for six years. Dr. Kurt Foster.Kurt, a brilliant psychologist in the field of sexual therapy, is a scientist to the core. Attraction and lust are nothing more than chemical reactions, in his clinical opinion. Love? It’s just a figment of the imagination born of nature’s directives. He’s on the brink of proving it with a new machine that uncovers latent desires.In short order, Becca’s forbidden lust for her boss is exposed. As Kurt continues to enlighten her on the darker facets of her sexuality, the student unexpectedly becomes the teacher.And suddenly Kurt is confronted with the irrefutable proof that love is so much more than a societal construction."
"AE6AB1EAD088400194F7A795C8B6F8AF",,true,"F. Scott Fitzgerald Collection","""Francis Scott Key Fitzgerald (September 24, 1896 – December 21, 1940) was an American writer of novels and short stories, whose works are evocative of the Jazz Age, a term he coined himself. He is widely regarded as one of the twentieth century's greatest writers. Fitzgerald is considered a member of the ""Lost Generation"" of the Twenties. He finished four novels, including The Great Gatsby, with another published posthumously, and wrote dozens of short stories that treat themes of youth and promise along with despair and age. The 1920s proved the most influential decade of Fitzgerald's development.The Great Gatsby, considered his masterpiece, was published in 1925. Fitzgerald made several excursions to Europe, notably Paris and the French Riviera, and became friends with many members of the American expatriate community in Paris, notably Ernest Hemingway. Hemingway looked up to Fitzgerald as an experienced professional writer. Hemingway greatly admired The Great Gatsby and wrote in his A Moveable Feast ""If he could write a book as fine as The Great Gatsby I was sure that he could write an even better one"" (153). Hemingway expressed his deep admiration for Fitzgerald, and Fitzgerald's flawed, self-defeating character, when he prefaced his chapters concerning Fitzgerald in A Moveable Feast with: His talent was as natural as the pattern that was made by the dust on a butterfly's wings. At one time he understood it no more than the butterfly did and he did not know when it was brushed or marred. Later he became conscious of his damaged wings and their construction and he learned to think and could not fly any more because the love of flight was gone and he could only remember when it had been effortless. (129) Much of what Hemingway wrote in A Moveable Feast helped to establish the myth of Fitzgerald's dissipation and loss (of ability, social control, and life) and Zelda's hand in that demise. Though the bulk of Hemingway's text is factually correct, it is also colored by his disappointment in Fitzgerald, as well as Hemingway's own rivalrous response towards any competitor, living or dead. That disappointment was most evident in The Green Hills of Africa, where he specifically mentions Fitzgerald as an archetypal ruined American writer; Hemingway had been both shocked and unnerved by Fitzgerald's account of his own difficulties in his nonfiction essays and notebooks from the 1930s, published as The Crack-Up (with Edmund Wilson as editor) in 1945. Fitzgerald’s friendship with Hemingway was quite vigorous and as many of Fitzgerald’s relationships would prove to be. (As, indeed, were many of the thrice-divorced Hemingway's.) Hemingway did not get on well with Zelda, either. He claimed that she “encouraged her husband to drink so as to distract Scott from his ‘real’ work on his novel,"" the other work being the short stories he sold to magazines. This “whoring”, as Fitzgerald, and subsequently Hemingway, called these sales, was a sore point in the authors’ friendship. Fitzgerald claimed that he would first write his stories in an authentic manner but then put in “twists that made them into saleable magazine stories.” "" Wikipedia."
"785DD1A9B1B246689BAF7C03901BC353",,true,"The Diary of a U-boat CommanderWith an Introduction and Explanatory Notes by Etienne","This book was converted from its physical edition to the digital format by a community of volunteers. You may find it for free on the web. Purchase of the Kindle edition includes wireless delivery."
"76323C01CD964C81A0A66870EC663109",,true,"A Twisted Bard's Tale: (Erotic Lesbian Short)","From NEW YORK TIMES bestselling and award-winning author Selena Kitt - Over Two Million Books Sold!---------Did you ever wonder what started the feud between the Capulets and the Montagues? Check out this naughty version of Romeo and Juliet--you'll be surprised and delighted by this twisted Bard's tale!. (Note: This title is a fun, erotic short). Check out ""From the Author"" below for MORE FREEBIES!. Get GIRLS ONLY: THE COMPLETE COLLECTION - FREE for KINDLE UNLIMITED amazon.com/dp/B00M07KMTU"
"EB76C37B34A04BDBB117BB9C7E0A319F",,true,"The Consolation Prize [Trueblood 1]","Series: Trueblood; Next Book: Falling for YouGenre: Vampire ParanormalLength: Novel. 'You are invited to spend four days at Sunset Spa, Washburn Hall. Accommodation and nourishment provided. All spa treatments included.'. It should have been a big thrill--an all expenses paid trip, but it was actually the topping on Chloe's really bad night. She'd lost her promotion, destroyed a pair of designer pumps, and turned in her notice. Washburn Hall, where her family died, was the last place she wanted to go. But Chloe's pulled towards the spa by forces beyond her control.. Luka is handsome, rich, and gay. That's what he'd like everyone to think. Luka's really a Trueblood, a fertile vampire. Not a bad thing, unless being staked out in the sun and fried to a crisp is appealing. But his secret gets out. Instead of staked, he gets shanghaied--straight into stud service and chained up in a basement of Washburn Hall.. Chloe wonders if the gorgeous naked man in chains is part of the all-inclusive package. Somehow she doesn't think so, but you know what? She's taking a consolation prize: free him and run. It should be simple enough. After all, the only thing between Chloe and the man of her dreams is a few horny vamps, a decent set of bolt cutters, and a step-grandmother from hell.. Who said the trip to the spa wouldn't be fun?. Publisher's Note: This book contains explicit sexual content, graphic language, and situations that some readers may find objectionable: Same-sex interaction (male/male, female/female), and violence."
