"id","request.custom_id","success","result.product.title","result.product.book_description"
"098A3FD84B724DA9A9165F9F19BDDD51",,true,,
"C7112119178B461594E6D6F55FA9BBD3",,true,,
"87B5CA211A2A49BDAED532B434AE5336",,true,"Dead(ish)","Linda's had a bad day. First her boyfriend killed her. Then she woke up, still on this boring plane of existence, and with an odd obsession about her missing body. Mike won't tell her what he did with her body, and she can't find the stupid thing herself. There's only one thing she can do - torment the bastard until he coughs up the information.. This is a very short work - novelette length - around 11000 words or 44 (print) pages.. Warning: Frequent foul language, mild sex scenes, and Australian spelling. Not suitable for children."
"64508741BE874C0696A11C08B5A77B12",,true,"The Zombie Chronicles: Outbreak","It was the start of another ordinary day at the office for Max, he was emailing a friend when one of his other early morning co-workers called for his help, someone was having a heart attack. Rushing to the aid of his fallen co-worker Max knew one thing, it wasn't a heart attack. Heart attack victims didn't bleed and didn't start chewing on anyone they could catch either. Once the victims died they came back to life with only one goal; to consume the living. Now Max was stuck in a rapidly deteriorating situation thirty miles from home, where his wife and two kids were sleeping away the warm mid summer morning. He had to get back to his family and get them to a safe place, if he could find one. Forming a group made up of his coworkers Steve and Tom and a police officer called 'Stewart' they make their way into the city to save the ones they love. The newly returned, however, were not all mindless shamblers and some of them had a plan.... This is a revised edition (2.2) uploaded on March 26th, 2011 and incorporates many spelling and grammar fixes send in from fans. Thanks for the feedback!"
"D6B6890E82964A8BB636B89D1DA0D2DE",,true,,
"A6CDDEF32D62436D889C20CBA300A0D8",,true,"Hot for Teacher (Jane Porter Book 4)","Who says three’s a crowd?Entrepreneur, fashionista and submissive-in-training, Jane Porter is headed to New Orleans with her lovers, Antonio and Santos. Armed with an invitation to the exclusive Marché d’Esclave, a members-only pleasure club, Jane steps into a world where submissives are auctioned to new masters for training. Happy with her current masters, Jane has no intentions of going up on the block herself until she comes to face to face with a man she’d thought never to see again…Among the patrons is the mysterious Archer, a master from Europe with legendary skills in the art of training. His submissives command the highest prices at auction and for those in search of a master, he is the one they crave. Intrigued by the beautiful Jane, he employs his considerable talents in the hopes of seducing her away from her lovers and returning to his home for a little higher education. Will Jane resist temptation or will she accept Archer’s invitation to explore more of the pleasure she’s come to crave…Warning: Extreme bondage, spanking, sexy men doing very naughty things to themselves and others, more spanking and the creative misuse of fruit."
"54FC90C8EAA449BE851F14C1C5D915D1",,true,"The Billionaire's Baby (Harlequin Mini # 19)","Garrett Winslow wants a woman to love him for himself, not for his family's money. So when he meets Haley Turner while on vacation in Mexico, he keeps his real name a secret. A family crisis abruptly ends their spring fling, and Garrett heads home, never knowing the night he spent with Haley has changed both of their lives forever..."
"4635355DA65045E8857F506F86B65E06",,true,"Educating Jane Porter","He’s throwing a kink—or two—in her plans…A Jane Porter story.Last night Jane met the Master of her dreams…Tall, dark and very Spanish, Antonio Villareal is a lover unlike any Jane has ever known—undeniably sexy and more than willing to help her explore her submissive side. To find a master who’s a natural dominant is one thing. But kind and considerate, as well? She can hardly believe her good fortune.Antonio is well aware that Jane is determined to keep their sexual relationship temporary. But he has a different plan in mind.In the morning he introduces her to his best friend…"
"FC4D6AE4D4844A1BB2B9D5861EBAB249",,true,,
"EC3EEA27572D469FBB49C0BA0BFCAF33",,true,,
"9E1E313578CE4B6088D51CC1E674C291",,true,"Love Script","Determined to land a huge advertising account for his company, Nick gets a LITTLE carried away and tells the potential client he's married, then he has a serious problem--he can't join the client on the ship unless he shows up with the wife he's supposed to be taking on an anniversary cruise.Laney Parks is either in the wrong place at the wrong time, or the right place at the right time-She isn't sure which. She isn't even entirely certain of how she got roped into posing as her hunky boss's wife. She finds it SERIOUSLY unnerving, though, to 'stick to the script' when that includes cuddling up and kissing in public, and even more unnerving to share the close confines of the cabin-and its single bed-with him. Rating: Adult situations and language."
"D8E5E25EB023488494B42B519C00F49B",,true,,
"2F1E20C4EC8E41D7B6B6B38714F590F1",,true,"Str8te Boys","How far would you dare to go…to win it all?Maverick Holms and Duke Warren share almost everything—a college soccer team, an apartment and the same extremely competitive nature. Thanks to that never-back-down spirit, they’re about to share more than they bargained for.The game is “gay chicken”. The rule: get as close as possible without kissing, and the one that pulls away first is the loser. The problem: neither of them likes to lose. It isn’t long before the game becomes an excuse to touch and kiss in every possible forbidden way. And after they pose for a gay website to earn extra money, things really heat up.Suddenly Duke is talking lifetime commitment, and Mav is backpedaling as hard as he can, not sure if he’s ready to accept all his best friend is offering him. Or the truth about what he is."
"0A44F5C554844CE29DFFEFE30B33D17F",,true,,
"735B3BDC8271452EB2EF6C91F83C1BA0",,true,"Day of Sacrifice : A Paranormal Romance","The Day of Sacrifice stories are serialized. Day of Sacrifice is part 1 of 6. All six stories are available together in the Day of Sacrifice Omnibus.. *****. With only three days left until her twenty-first birthday, her Day of Sacrifice, Flora Hamilton should be living it up. But when another Supernatural family puts a hit on her she’s forced to go into hiding with Julian, her gorgeous new Guardian Angel. Sometimes running for your life isn’t so bad.. *****. Day of Sacrifice is approximately 15,000 words. It is intended for adults due to language and sexual situations.. *****. Day of Sacrifice Series:Day of SacrificeRebellionDormantTakeoverDissentUnfavorable"
"DF1FC1558C8746AF93B884D1A9E38BAE",,true,,
"E5C94A5919654F488E585A25582CEFBB",,true,"No Good Deed: A Psychological Thriller","Seeing the future comes at a price. Mark Taylor knows his actions scream guilty—but he was only trying to stop the horrible terrorist attack. When the government suspects him of involvement, he finds himself caught in legal limbo with no rights, no trial, and no way to prove his innocence. He learns first hand that the CIA can do anything they want to him—anything at all.Mark's just a regular guy—a photographer—who finds himself in an extraordinary situation when an antique camera he buys at a dusty Afghanistan bazaar produces photographs of future tragedies. Tragedies he's driven to prevent.His frantic warnings about September 11th are ignored but put him in the government cross-hairs where he learns what being labeled an 'enemy combatant' really means...Get this intense and gripping thriller now!"
"B760B8834D6E48FF9329BBB008A48C71",,true,,
"C7D3A1F284254F3FBBFAE778141FDCBA",,true,,
"5FE5582E3B584AD8858F4098AE2F9A8D",,true,"The Billionaire's Baby (Harlequin Mini # 19)","Garrett Winslow wants a woman to love him for himself, not for his family's money. So when he meets Haley Turner while on vacation in Mexico, he keeps his real name a secret. A family crisis abruptly ends their spring fling, and Garrett heads home, never knowing the night he spent with Haley has changed both of their lives forever..."
"C46965C484F348B7B576BF95983A6696",,true,"Str8te Boys","How far would you dare to go…to win it all?Maverick Holms and Duke Warren share almost everything—a college soccer team, an apartment and the same extremely competitive nature. Thanks to that never-back-down spirit, they’re about to share more than they bargained for.The game is “gay chicken”. The rule: get as close as possible without kissing, and the one that pulls away first is the loser. The problem: neither of them likes to lose. It isn’t long before the game becomes an excuse to touch and kiss in every possible forbidden way. And after they pose for a gay website to earn extra money, things really heat up.Suddenly Duke is talking lifetime commitment, and Mav is backpedaling as hard as he can, not sure if he’s ready to accept all his best friend is offering him. Or the truth about what he is."
"D43C8AFAFFC444058E2910E6E0E5A927",,true,"Lori Foster Bundle (The Buckhorn Brothers Book 1)","Lori Foster Bundle by released on Jul 1, 2007 is available now for purchase."
"D28F8C0A0BDB403D84B16F4402853DC2",,true,,
"85244303548D4C1D9DA11A9F79B37A73",,true,"Indian Fairy Tales","This book was converted from its physical edition to the digital format by a community of volunteers. You may find it for free on the web. Purchase of the Kindle edition includes wireless delivery."
"A7CE48B3AD5948D2850AB933A847A9F6",,true,"Christmas Cash (Raising Cain)","If you can't beat him, irritate the hell out of him.Moving back home to Chaos, Texas wasn't working out quite the way Noelle had planned. The last thing she expected was a seasonal job that included dressing up as Mrs. Claus while ringing a bell for charity, but thanks to Cash McCain, she wasn't left much of a choice.Cash can't believe what ten years can do for a woman. The last time he'd seen Noelle, she'd been all knees and elbows. Now a woman grown yet still ten years his junior, thus too young for him, Noelle has filled out in a way that should be illegal. When Cash refuses her a job at Raising Cain, a Texas honky-tonk run by the McCain siblings, she takes it upon herself to make his life miserable. Who could have imagined the damage a tiny, tinkling bell could cause to a man's sanity?But when things heat up, Cash begins to think that raising a little cane with the likes of Noelle might not be such a bad thing after all."
"EC123C2DC24948F586B16F4E1A99948B",,true,,
"7C5A58E696C247A68315DA174273E08E",,true,"Bound By Blood: The Faustin Bros., Book 2 (Faustin Brothers)","Scorn Fate and she’ll bitch slap you back.The Faustin Bros., Book 2The damned will be sucking snow cones in hell before Gregor Faustin succumbs to love and marriage. Or so he thinks. Until he ploughs his BMW straight into destiny. Madelena, with her smart mouth and her luscious ass, her old-man wardrobe and pointed questions, affects him like no woman he’s ever met. Gregor can’t decide if he’d rather throttle her, suck every sweet drop of blood from her body, or lock her in a room and make love to her until they both die of exhaustion. The only answer—stay far, far away.Maddy begs the man who ran her over to keep her out of the hospital. In answer, he heals her with a kiss that leaves her haunted by erotic, soul-stealing dreams. But she’s got too many problems to risk what’s left of her heart on any man.Gregor would like nothing better than to pull his usual disappearing act, but he finds himself entangled with Maddy in a way that goes beyond obsession. By tasting a few precious drops of her blood, he’s bound his life to hers. Now both their days are numbered."
"CD137D7B7656408CBB91CDB9A277A3DD",,true,"The Zombie Chronicles: Outbreak","It was the start of another ordinary day at the office for Max, he was emailing a friend when one of his other early morning co-workers called for his help, someone was having a heart attack. Rushing to the aid of his fallen co-worker Max knew one thing, it wasn't a heart attack. Heart attack victims didn't bleed and didn't start chewing on anyone they could catch either. Once the victims died they came back to life with only one goal; to consume the living. Now Max was stuck in a rapidly deteriorating situation thirty miles from home, where his wife and two kids were sleeping away the warm mid summer morning. He had to get back to his family and get them to a safe place, if he could find one. Forming a group made up of his coworkers Steve and Tom and a police officer called 'Stewart' they make their way into the city to save the ones they love. The newly returned, however, were not all mindless shamblers and some of them had a plan.... This is a revised edition (2.2) uploaded on March 26th, 2011 and incorporates many spelling and grammar fixes send in from fans. Thanks for the feedback!"
"E6BC88A938574F73A5B600EF1DE5CAA3",,true,"Unwrapped","He’s going to give her the Christmas gift of her dreams…in triplicate.When Justin Garrett accidentally views Amy Parker’s private online journal, he sees the cold corporate exec in a brand new light. It seems the icy, unapproachable Amy has fantasies. Fantasies that both appall and intrigue her.No one knows the real Amy Parker, and she’s satisfied to keep it that way. A woman with kinky tastes wouldn’t cut it in the straight-laced law firm where she’s fought her way to partnership. And she certainly refuses to let an underling use her to advance in the firm. Justin Garrett might be brilliant, gorgeous, and sexy as hell, but he’s firmly restricted to her fantasies and that’s where he’ll stay.While working together on a corporate acquisition in Hawaii over the Christmas holidays, Justin sets out to make Amy’s secret fantasy come true—a night of passion with two men who adore her. And he knows the ideal other man to help Amy unwrap the perfect Christmas gift.But first he has to melt her heart and convince her he sees her as a woman, not a rung to climb on the career ladder. In fact, by giving Amy exactly what she’s always wished for, Justin hopes to climb right into her heart."
"82B361E6BBAA4C45AF8D76F0A9BF407C",,true,"Soul Hunger (Ra's Chosen, Book One)","Book one in the Ra’s Chosen series.As one of Ra’s Chosen warriors, Mehen must protect mortals from the undead who hunt them. Gifted by the sun god Ra, Mehen has never struggled with the task—until he saves a woman from three undead, and finds himself in need of saving. Something about the woman stirs him, and he’s consumed by his need not only for her body, but also her blood.Blythe may have been saved by the mysterious man, but her reaction to the feel of his arms around her and the way his eyes wander to her neck don’t make her feel much safer. When she’s taken to his headquarters against her will, she finds herself a prisoner. But when he unleashes passion unlike any she’s ever known, she realizes she’ll do anything to stay imprisoned.But Blythe is not who she seems. And Mehen finds himself in the fight of his life to save the woman he loves from the evil that yearns to possess her."
"36F831359E724903A6C0F5901CEA6B60",,true,"Kindle Nation Daily  Kindle Edition",
"6A437D1CAA5047D1AE7B71A61C25D445",,true,"CHARACTER WITNESS (legal thriller, mystery)","A shared cubicle in a strip-mall law office wasn't the kind of career Kathleen Cotter dreamed of, but all that changes when her uncle invites her to join his Beverly Hills firm. But the offices are on the wrong end of 90210, and her uncle's glory days are over. Though it's another dead-end for Kathleen, she promises to see her one case through to the end. Instead of an open and shut insurance claim, Kathleen finds herself drawn into a web of lies, corruption, scandal, and murder. To save her own life she can sell-out or take on the powers that be. Either way, Kathleen will find that on the right side of Beverly Hills life is cheap and character is a four-letter word.“A riveting legal whodunit…”– USA Today"
"EA805B6674544BF9B0732D13084A0720",,true,"Emergency: Wife Lost and Found","Every doctor dreaded recognizing someone in the emergency room—even coolheaded consultant James Morrell. But he was doubly shocked when the unconscious patient he had been asked to treat was instantly familiar. It was his ex-wife!. Dr. Lorna McClelland hated being ill, hated being stuck in a hospital bed and, above all, hated having to rely on James. But as she recovered, all the wonderful things about their marriage came flooding back….."
"E6CB0B1F136A4E21BD246BDF8C0695CE",,true,,
"F3347F3C338F492A9EB0E5C405FD33DE",,true,"The Hall of the Wood: An Epic Fantasy Adventure","A chilling warning. A fragile alliance. Impending doom.. Jerrick Bur returns to a home he doesn't recognize. The King's Patrol has vanished. Their Hall stands empty. An invading army encroaches upon the fringes of the forest and folk whisper of a sitheri witch brewing evil from the darkest hollows.. Once a patroller, always a patroller, and so Jerrick is duty-bound to investigate. He is joined by Kayra Weslin, knight errant, and her chronicler, Holly, who go to answer a plea for help from nearby Homewood. Along with Murik Alon Rin'kres, an eslar sorcerer who harbors a secret purpose all his own, the four embark upon a mission to unravel the mystery of the missing patrollers and somehow stop an ancient force of darkness from consuming them all."
"E0743D09CDC44937B1F9307A9034CE0B",,true,"Saddled","Slippery when naked…When Bobby Blackhawk and Cale Yancey see a car slide off the highway and into an icy creek, they’ve got only minutes to get the beautiful driver out alive. And only one way to save her from hypothermia: take her to their isolated cabin, get naked…and hope like hell that when she wakes up, she doesn’t scream the place down.Katherine Duvall opens her eyes in a strange bed, and the tingles flooding her body aren’t entirely due to restored circulation. She’s snuggled between two handsome men, one a gruff, gentle giant, the other a sexy, playful Native American. Having just left her fiancé romping with another woman, she’s not quite as shocked as she might have been.In fact, these two lonesome cowboys could be the perfect bookends to satisfy her hunger for revenge and bolster her dented self esteem. It’s not long before their raging hormones are melting the snow on the cabin roof.To their surprise, they find something else is melting, too. Their hearts…"
"AAD59AD5AA2E4D9198D39190B42B1BD6",,true,"The Seeking Kiss, (The Midnight Playground Book 1)","Two vampires, one woman, an eternity of love and desire…if only she’s strong enough…Midnight Playground, Book 1London 2069For as long as Nissa has known about Midnight Playground, the most exclusive of a world-wide network of vampire sex clubs, she has yearned to gain entrance—and to become one of them. Orphaned and alone from a young age, she has nothing to lose and nothing to stop her from indulging in her darkest fantasies.Hex and his maker, Aleron, have enjoyed many play partners at the club and have often shared in the euphoria of the Seeking Kiss, that sensual blood exchange between vampires and their lovers. But Nissa’s beauty, intelligence and strength is a siren call he can’t resist.. His desire for her and her willingness to let herself be drawn by their mental pull compels Hex to consider offering to her something he’s never given another mortal– the treasured Turning Kiss.The beautiful vampire pair entice Nissa into an intimate sexual realm beyond her wildest dreams—and she revels in it. But when she finds herself falling for one of the powerful duo, it could mean the end of her deepest fantasies. Or a new beginning she never dared to imagine…Warning: Three-way vampire sex, voyeurism, exhibitionism, anal sex, oral sex, simultaneous anal and oral sex (oh, yes, it’s possible!), drinking blood, drinking blood while having sex, political unrest , and a hot French accent. Keep a fan and some holy water nearby!"
"B703A4F1212A407A97102CDA0B2BC646",,true,,
"6688CF909D00460487A63EF87AD2486C",,true,"The Economist - US Edition  Kindle Edition",
"776042D7320548C2900DED72A880D545",,true,"Her Dark Angel (Her Angel Romance Series Book 1)","An angel trapped in Hell for centuries, Apollyon is tired of guarding the Devil. He longs to break free and feel the wind in his feathers, but he cannot leave the endless darkness without permission from above. When he senses someone calling him, he seizes his chance for freedom, but soon discovers the call came from a beautiful woman he has watched over from Hell, a woman who casts a spell on him and awakens the darkest desires of his heart.. Serenity is shocked when a wickedly sensual black-winged angel shows up in her city of Paris claiming that she called him when she was only casting a simple vengeance spell. He’s no other than the angel of death! When the lethally handsome warrior offers to obey her and give her revenge, Serenity can’t resist the temptation, but can she resist the forbidden hungers the dark angel stirs in her?. Intense and passionate, Her Dark Angel is a tale of desire and deepest forbidden love guaranteed to set your heart racing.. Enter the gripping, sensual, intense and dramatic paranormal romance world of the Her Angel romance series by New York Times and USA Today best-selling paranormal romance author Felicity Heaton, where passionate angels fight to protect the women who capture their hearts from a deadly war...Book 1: Her Dark AngelBook 2: Her Fallen AngelBook 3: Her Warrior AngelBook 4: Her Guardian AngelBook 5: Her Demonic AngelBook 6: Her Wicked AngelBook 7: Her Avenging AngelBook 8: Her Sinful Angel"
"BB636F332FF04727AA69E848E4D2EE17",,true,"From Afar","Some rules are destined to be broken.Loneliness. A concept with which Raphael Laurent is very familiar. He’s lived a solitary life for thirty-six years, shunning the excesses of the local vampire clan—until he spots Lord Aleric Vane, the handsome and dissolute third son of a duke. For three years Raphael has watched from a distance, for only when he is near Aleric does the hollow, empty ache in his chest ease.Cut off from his family for refusing to follow his father’s dictates, Aleric’s nights are filled with vice. But after three years in London, the city has lost all appeal. Desolate and penniless, his future appears bleak. Until a mysterious man drops from the shadows to drive off a trio of murderous thieves.When Aleric awakens, he finds himself forever changed. The itch for more that drove him to London is gone. In its place is the feeling that he’s known the beautiful Raphael all his life.But to save Aleric, Raphael had to break the rules, giving him a chance to love the one man he never thought he could have—a chance that could be ripped away by Aleric himself…"
"8DB837CC51C84561BBAFE4FF406AE750",,true,,
"0CDD944DA479465BA31CA9D9F65F9648",,true,"Body Check","Hard body? Check. Awesome-night-in-the-sack potential? Check! Hayden Houston is breaking out of her good-girl mode. It's time for a one-night stand—and she's found just the man for the job! She spent her childhood being dragged from rink to rink by her hockey-coach father. Now Hayden craves stability. And she's determined to get it—after this one night.…. When hockey star Brody Croft sees the sexy brunette at the bar, he's riveted. He's ready to shed his bad-boy ways and settle down. And after a mind-blowing night in bed with Hayden, he knows she's the one.. Now all he has to do is convince her….."
"B016183D0CA748B493ACF6FFFEB59F0E",,true,,
"06E39E1E322B46F3A79A08C60CAEF16E",,true,"Kindle Nation Daily  Kindle Edition",
"06E45EBDEDD94B24A6841A7097E7E50E",,true,"The Boston Globe  Kindle Edition",
"87666BC9652C4F3FA5624695958DA12F",,true,"The Ties that Bind","When Lady Arabella’s errant husband returns after a two-year absence that began just after the consummation of their marriage, she’s still furious with him. Will past hurts finally be explained, and will Lord James be shocked to discover that Arabella has made the best of the situation with the help of his best friend, Tom? Or will Lord James turn the tables, reveal all, and win their sexual game for an unconventional happy ever after?. Please note. This book contains m/f/m sexual interaction and mild infidelity."
"1407BD37BBE54CB8982AC83E14D76503",,true,"Taking Instruction (Taboo)","Taboo series.Jessica Grayson is a college freshman who's had the hots for her university professor all year long. He's sexy and unobtainable—and she's determined to get into his bed.Dating one of his own students is taboo and Craig Bennett intends to never break that school rule… Until he finds an end-of-the-semester present in his office—the gorgeous co-ed he hasn't been able to keep off his mind. And she's naked, sitting on his desk.It isn't long before Jessica discovers she's gotten more than she bargained for. She finds out exactly who's in control as she learns how the professor likes to play. A whole new world of BDSM is opened up to her and being a bad girl never felt so good."
